{
  "version": "0.2.0",
  "map_id": "arena_01",
  "display_name": "⚔ 竞技场 - 骑士挑战",
  "tilesets": [
    { "id": 1, "name": "farm", "first_id": 1 },
    { "id": 2, "name": "village", "first_id": 100 },
    { "id": 3, "name": "forest", "first_id": 200 },
    { "id": 4, "name": "castle", "first_id": 300 },
    { "id": 5, "name": "admin", "first_id": 400 }
  ],
  "layers": [
    { "index": 0, "name": "Layer0 背景远景", "cells": [] },
    { "index": 1, "name": "Layer1 背景近景", "cells": [] },
    {
      "index": 2,
      "name": "Layer2 ArenaFloor",
      "cells": [
        [1,13,3],[2,13,3],[3,13,3],[4,13,3],[5,13,3],[6,13,3],[7,13,3],[8,13,3],[9,13,3],[10,13,3],
        [11,13,3],[12,13,3],[13,13,3],[14,13,3],[15,13,3],[16,13,3],[17,13,3],[18,13,3],[19,13,3],[20,13,3],
        [21,13,3],[22,13,3],[23,13,3],[24,13,3],[25,13,3],[26,13,3],[27,13,3],[28,13,3],[29,13,3],[30,13,3],
        [31,13,3],[32,13,3],[33,13,3],[34,13,3],[35,13,3],[36,13,3],[37,13,3],[38,13,3],[39,13,3],[40,13,3],
        [41,13,3],[42,13,3],[43,13,3],[44,13,3],[45,13,3],[46,13,3],[47,13,3],[48,13,3],[49,13,3],
        [1,14,3],[2,14,3],[3,14,3],[4,14,3],[5,14,3],[6,14,3],[7,14,3],[8,14,3],[9,14,3],[10,14,3],
        [11,14,3],[12,14,3],[13,14,3],[14,14,3],[15,14,3],[16,14,3],[17,14,3],[18,14,3],[19,14,3],[20,14,3],
        [21,14,3],[22,14,3],[23,14,3],[24,14,3],[25,14,3],[26,14,3],[27,14,3],[28,14,3],[29,14,3],[30,14,3],
        [31,14,3],[32,14,3],[33,14,3],[34,14,3],[35,14,3],[36,14,3],[37,14,3],[38,14,3],[39,14,3],[40,14,3],
        [41,14,3],[42,14,3],[43,14,3],[44,14,3],[45,14,3],[46,14,3],[47,14,3],[48,14,3],[49,14,3],
        [0,9,3],[0,10,3],[0,11,3],[0,12,3],[0,13,3],[0,14,3],
        [50,9,3],[50,10,3],[50,11,3],[50,12,3],[50,13,3],[50,14,3]
      ]
    },
    { "index": 3, "name": "Layer3 装饰物件", "cells": [] },
    { "index": 4, "name": "Layer4 前景装饰", "cells": [] },
    { "index": 5, "name": "Layer5 特效", "cells": [] },
    { "index": 6, "name": "Layer6 实体碰撞", "cells": [] },
    { "index": 7, "name": "Layer7 UI/标记", "cells": [] }
  ],
  "entities": [
    { "id": "cp_start", "kind": "checkpoint", "x": 200, "y": 600, "props": { "cp_id": "cp_start", "restore_hp": true } },
    { "id": "enemy_s_1", "kind": "enemy", "x": 1600, "y": 600, "props": { "hp": 80, "atk": 14, "patrol_r": 80, "chase_r": 500, "attack_r": 40, "cd": 1.0 } },
    { "id": "enemy_s_2", "kind": "enemy", "x": 1800, "y": 600, "props": { "hp": 80, "atk": 14, "patrol_r": 80, "chase_r": 500, "attack_r": 40, "cd": 1.0 } },
    { "id": "enemy_k_1", "kind": "enemy", "x": 1100, "y": 600, "props": { "hp": 180, "atk": 24, "patrol_r": 40, "chase_r": 400, "attack_r": 44, "cd": 1.4 } },
    { "id": "ch_1", "kind": "chest", "x": 2300, "y": 600, "props": { "loot": { "gold": 80, "potion": 2 }, "is_locked": false } },
    { "id": "exit_p", "kind": "portal", "x": 2350, "y": 600, "props": { "target_level": "admin_hall", "need_objectives_done": true } }
  ],
  "objectives": [
    { "logic": "AND" },
    {
      "id": "kill_boss",
      "type": "BOSS",
      "data": { "enemy_id": "enemy_k_1" },
      "reward": { "gold": 100, "unlock": ["title_arena_champion"] }
    },
    {
      "id": "kill_ads",
      "type": "DEFEAT_ENEMY",
      "data": { "enemy_ids": ["enemy_s_1", "enemy_s_2"] },
      "reward": { "gold": 40 }
    }
  ],
  "meta": {
    "spawn": { "x": 200, "y": 620 },
    "next_level": "admin_hall",
    "template_name": "arena",
    "mode": "ARENA",
    "min_rank": 3,
    "bounds": { "x": 0, "y": 0, "w": 2448, "h": 1080 },
    "create_ts": "2025-01-01T00:00:00"
  }
}
