{
  "version": "0.2.0",
  "map_id": "farm_01",
  "display_name": "🌾 农场 - 新手村",
  "tilesets": [
    { "id": 1, "name": "farm", "first_id": 1 },
    { "id": 2, "name": "village", "first_id": 100 },
    { "id": 3, "name": "forest", "first_id": 200 },
    { "id": 4, "name": "castle", "first_id": 300 },
    { "id": 5, "name": "admin", "first_id": 400 }
  ],
  "layers": [
    { "index": 0, "name": "Layer0 背景远景", "cells": [] },
    { "index": 1, "name": "Layer1 背景近景", "cells": [] },
    {
      "index": 2,
      "name": "Layer2 地面",
      "cells": [
        [0,14,1],[1,14,1],[2,14,1],[3,14,1],[4,14,1],[5,14,1],[6,14,1],[7,14,1],[8,14,1],[9,14,1],
        [10,14,1],[11,14,1],[12,14,1],[13,14,1],[14,14,1],[15,14,1],[16,14,1],[17,14,1],[18,14,1],[19,14,1],
        [20,14,1],[21,14,1],[22,14,1],[23,14,1],[24,14,1],[25,14,1],[26,14,1],[27,14,1],[28,14,1],[29,14,1],
        [30,14,1],[31,14,1],[32,14,1],[33,14,1],[34,14,1],[35,14,1],[36,14,1],[37,14,1],[38,14,1],[39,14,1],
        [40,14,1],[41,14,1],[42,14,1],[43,14,1],[44,14,1],[45,14,1],[46,14,1],[47,14,1],[48,14,1],[49,14,1],
        [50,14,1],[51,14,1],[52,14,1],[53,14,1],[54,14,1],[55,14,1],[56,14,1],[57,14,1],[58,14,1],[59,14,1],
        [10,10,3],[11,10,3],[12,10,3],[13,10,3],[14,10,3],[15,10,3],[16,10,3],[17,10,3],[18,10,3],[19,10,3],[20,10,3],[21,10,3],
        [30,8,4],[31,8,4],[32,8,4],[33,8,4],[34,8,4],[35,8,4],[36,8,4],[37,8,4],[38,8,4],[39,8,4],[40,8,4],[41,8,4]
      ]
    },
    { "index": 3, "name": "Layer3 装饰物件", "cells": [] },
    { "index": 4, "name": "Layer4 前景装饰", "cells": [] },
    { "index": 5, "name": "Layer5 特效", "cells": [] },
    { "index": 6, "name": "Layer6 实体碰撞", "cells": [] },
    { "index": 7, "name": "Layer7 UI/标记", "cells": [] }
  ],
  "entities": [
    { "id": "cp_1", "kind": "checkpoint", "x": 200, "y": 760, "props": { "cp_id": "cp_start", "restore_hp": true } },
    { "id": "chest_1", "kind": "chest", "x": 744, "y": 432, "props": { "loot": { "gold": 30 }, "is_locked": false } },
    { "id": "sc_1", "kind": "enemy", "x": 1100, "y": 660, "props": { "hp": 30, "atk": 10, "patrol_r": 40, "chase_r": 180, "attack_r": 34, "cd": 1.2 } },
    { "id": "np_f", "kind": "npc", "x": 80, "y": 760, "props": { "name": "Farmer John", "dialog": "join_me_farm", "recruit_cost": 50, "hp": 60, "atk": 8 } },
    { "id": "pt_n", "kind": "portal", "x": 2800, "y": 640, "props": { "target_level": "village_edge_01", "need_objectives_done": true } },
    { "id": "tr_reach", "kind": "trigger", "x": 1600, "y": 680, "props": { "obj_id": "reach_end", "size_w": 120, "size_h": 120, "action": "objective_done" } }
  ],
  "objectives": [
    { "logic": "AND" },
    {
      "id": "reach_end",
      "type": "REACH_AREA",
      "data": { "x": 1600, "y": 680, "w": 120, "h": 120 },
      "reward": { "gold": 20 }
    },
    {
      "id": "sc_die_1",
      "type": "DEFEAT_ENEMY",
      "data": { "enemy_ids": ["sc_1"] },
      "reward": { "unlock": ["skin_default"], "gold": 15 }
    }
  ],
  "meta": {
    "spawn": { "x": 200, "y": 800 },
    "next_level": "village_edge_01",
    "template_name": "farm",
    "mode": "PVE",
    "min_rank": 1,
    "bounds": { "x": 0, "y": 0, "w": 2880, "h": 1080 },
    "create_ts": "2025-01-01T00:00:00"
  }
}
